{
  "schema_version": "1.1",
  "source_media": "synthetic-tone-and-silence.wav",
  "duration_seconds": 2.0,
  "created_at_utc": "2026-10-13T17:27:21.642829+00:00",
  "generated_by": "physical-audio-v1",
  "analysis": {
    "sample_rate_hz": 16000,
    "channels": 1,
    "audio_stream": 0,
    "decoder": "PyAV",
    "decoder_version": "18.1.0",
    "numpy_version": "2.5.4",
    "window_seconds": 1,
    "silence_dbfs": -40,
    "min_pause_seconds": 0.3,
    "pitch_enabled": true,
    "max_seconds": null,
    "pitch_method": "normalized-autocorrelation-v1",
    "pitch_range_hz": [
      60,
      600
    ],
    "frame_seconds": 0.04,
    "periodicity_threshold": 0.85,
    "min_voiced_fraction": 0.5
  },
  "feature_definitions": {
    "rms": "linear full-scale amplitude of resampled mono audio; no loudness normalization",
    "rms_dbfs": "20*log10(rms), dBFS; null for digital zero",
    "pitch_median_hz": "periodic frame pitch median in Hz; null if insufficient periodicity",
    "pitch_periodicity": "normalized autocorrelation; not a probability or speech confidence",
    "voiced_fraction": "fraction of periodic frames; null when pitch disabled",
    "low_energy_fraction": "fraction of samples in frames below silence_dbfs",
    "pauses": "low-energy intervals, not verified speech pauses; music/noise may mask silence"
  },
  "windows": [
    {
      "start": 0.0,
      "end": 1.0,
      "rms": 0.14140369213080153,
      "rms_dbfs": -16.990785014304368,
      "pitch_median_hz": 200.0,
      "pitch_periodicity": 1.0,
      "voiced_fraction": 1.0,
      "low_energy_fraction": 0.0,
      "speech_detected": null,
      "laughter_probability": null
    },
    {
      "start": 1.0,
      "end": 2.0,
      "rms": 0.0,
      "rms_dbfs": null,
      "pitch_median_hz": null,
      "pitch_periodicity": null,
      "voiced_fraction": 0.0,
      "low_energy_fraction": 1.0,
      "speech_detected": null,
      "laughter_probability": null
    }
  ],
  "pauses": [
    {
      "start": 1.0,
      "end": 2.0
    }
  ]
}
